<?xml version="1.0"?>
<xsd:schema xmlns:xsd="http://www.w3.org/2001/XMLSchema">

    <xsd:element name="tree">
        <xsd:complexType>
            <xsd:sequence>
                <xsd:element name="node" type="Node" minOccurs="0" maxOccurs="unbounded"/>
            </xsd:sequence>
        </xsd:complexType>
    </xsd:element>

    <xsd:complexType name="Node">
        <xsd:sequence>
            <xsd:element name="child" minOccurs="0" maxOccurs="unbounded">
                <xsd:complexType>
                    <xsd:attribute name="idref" type="xsd:IDREF" />
                </xsd:complexType>
            </xsd:element>
        </xsd:sequence>
        <xsd:attribute name="id" type="xsd:ID" use="required"/>
        <xsd:attribute name="name" type="xsd:string"/>
    </xsd:complexType>


</xsd:schema>